page_name,post_id,comment_no,reply_no,comment_text,username_anonymised,n_reactions,post_date,collection_date,replied_to_username
Unknown,pt_post003,41,0,بٹھو نے GB سے سٹیٹ سبجیکٹ رول ختم کرکے سہولتکاری کی تھی اور آج اسکی پارٹی لینڈ ریفارمز کے نام پر جنگل پہاڑ معدنیات اسٹیبلشمنٹ کے حوالے کرنے میں سہولت کار نکلی۔ بٹھو کل بھی غدار آج بھی غدار ہے.,6943b69d45ca82e5a4229064a3e31c02f95a4960,12,35w,1/24/2026 15:09,
Unknown,pt_post003,41,1,Bhutto shuru se begairaat insaan tha lekin awam ne pechane mei bht dair laga di. Jo jo GB mei bhutto k supporters hain sab k against awam ko bahr ana chahye hai.,7aae99421fafb2508aa99b7009dc9868eb7d31af,0,35w,1/24/2026 15:09,6943b69d45ca82e5a4229064a3e31c02f95a4960
Unknown,pt_post003,42,0,Pahad gaye zameen gaya,1a076137b4e2d677be58d5a450aabcf2a05bb14d,2,35w,1/24/2026 15:09,
Unknown,pt_post003,43,0,What are the contraindications of this bill .,76160f3a099159eb9d0b631100240e668f4adf38,0,35w,1/24/2026 15:09,
Unknown,pt_post003,44,0,وطن فروش اصول بیچ کے مسند خریدنے والو نگاہ اہلِ وفا میں بہت حقیر ہو تم وطن کا پاس تمہیں تھا ــ نہ ہو سکے گا کبھی کہ اپنی حرص کے بندے ہو ــ بے ضمیر ہو تم,f59ec586e355a28910974e66fc775c1f8c40e5ab,7,35w,1/24/2026 15:09,
Unknown,pt_post003,45,0,یعنی اب پہاڑ چراگاہیں جنگل عوام کی ملکیت سے نکل کے ناقابل تقسیم زمین کہلائیں گے۔ اس سے بہتر وہی خالصہ سرکار تھا جس میں عوام کو چراگاہ کے حقوق دیئے ہوئے تھے۔,29f2736af00707a836c695386edf72c4e7c021c2,6,35w,1/24/2026 15:09,
Unknown,pt_post003,45,1,دیر کر دی اپنے منتخب نمائندے جنہوں نے اس بل کے حق میں ووٹ دیا کو پکڑنا چائیے تھا۔,57d76f6ba01bbfa2299845633e0f656e9a8d555c,0,35w,1/24/2026 15:09,
Unknown,pt_post003,46,0,Hence sold,b2cf4bfd09a07b4bfb9edd4fc19973b8bdecebd6,0,35w,1/24/2026 15:09,
Unknown,pt_post003,47,0,GB Assembly...mean East India company,594d911f4fdae4b194ca1aba4335817fbb27f1cb,4,35w,1/24/2026 15:09,
Unknown,pt_post003,48,0,گلگت بلتستان لینڈ ریفارم بل سے سب سے زیادہ متاثر بلتستان ریجن ہوگا ۔، کیونکہ دیامر اس بل سے مستنثنیٰ ہے گلگت میں زمینیں کم ہے۔ جبکہ بلتستان میں سب سے زیادہ بنجر زمینیں ہے جو کسی بھی وقت ڈی سی صاحبان کسی کو بھی الاٹ کر سکتے ہیں۔,29f2736af00707a836c695386edf72c4e7c021c2,16,35w,1/24/2026 15:09,
Unknown,pt_post003,49,0,We strongly reject the so-called colonial system in GB,a4f2000891139b423440ff21aa4d9778c11b9a09,0,35w,1/24/2026 15:09,
Unknown,pt_post003,50,0,We are becoming a colony of Pakistani establishment officially..,55810925f5d41925712370b45f5711f704727091,37,35w,1/24/2026 15:09,
Unknown,pt_post003,50,1,lihaza is aaalishan imarat ko masmaar Kiya jaye...,cf444d75d2e43eca1a30d4ac94de0f8e5f6de884,0,35w,1/24/2026 15:09,55810925f5d41925712370b45f5711f704727091
Unknown,pt_post003,50,2,Pakistan establishment Punjab establishment,8f4a0cca74c30a01df6bbc8dc0a087693cfc8564,0,35w,1/24/2026 15:09,55810925f5d41925712370b45f5711f704727091
Unknown,pt_post003,50,3,cry,d4c245531e8a44e4a6416c591a0b17b89030ee92,0,35w,1/24/2026 15:09,8f4a0cca74c30a01df6bbc8dc0a087693cfc8564
Unknown,pt_post003,50,4,"jani , we are already since 1947",7f2cea3c3141fca928e713f501be06deb2ce5701,0,35w,1/24/2026 15:09,55810925f5d41925712370b45f5711f704727091
Unknown,pt_post003,50,5,"کیوں اس عمارت کو آپ نے بنوایا ہے,؟؟؟؟",bc0ab55f3c366a01975f4b5b88be03a0c660f2d2,0,35w,1/24/2026 15:09,cf444d75d2e43eca1a30d4ac94de0f8e5f6de884
Unknown,pt_post003,51,0,Bill passed by majority of pimps.,6f273d7a0e7c25d09f26e1488ec5539c542c9722,0,35w,1/24/2026 15:09,
Unknown,pt_post003,52,0,Naam bada Awami action committee. Sub mily hain?,e0b9f84a16998643ef6042092d55cba675f4cd90,0,35w,1/24/2026 15:09,
Unknown,pt_post003,53,0,Welcome to colonizing,ee003417cae9194124ad6daaa5341676fbd5532d,0,35w,1/24/2026 15:09,
Unknown,pt_post003,54,0,Gb me ab d h a or business karei. Gya napak fouj,52d25e65f38cd4eddc806e5cbe321afa2b4971cb,0,35w,1/24/2026 15:09,
Unknown,pt_post003,55,0,Ya khaaa waa faaaaq sam thai ten gileetay,551b95482b6f7e422a429c64ec02e9dd104b4c11,0,35w,1/24/2026 15:09,
Unknown,pt_post003,56,0,Madrchood opposition or taty uthanay Walaa assembly members ya ek din Pura gilgit he baach dengy,fd40806b463ea3e21bf9e2c3863e6df6eb14de39,2,35w,1/24/2026 15:09,
Unknown,pt_post003,57,0,Sara dalal banay huwa ha,0149fd102655028b0e9d2d37d412b7e1d90bf81a,0,35w,1/24/2026 15:09,
Unknown,pt_post003,58,0,"Sara dalalu na approved Kia Hoga ya bill, Mali jar*",64dbe998c500373283f563ecccd8ec79f9aa010e,2,35w,1/24/2026 15:09,
Unknown,pt_post003,59,0,گلگت بلتستان اقوام متحدہ کے کشمیر فریم ورک کے تحت متنازعہ علاقہ ہے۔ Pakistan پاکستان میں اس کی کوئی آئینی حیثیت نہیں ہے ، قومی اسمبلی میں کوئی نمائندگی نہیں ہے ، اور وہ ایگزیکٹو کنٹرول میں ہے۔ پھر بھی قوانین بغیر کسی رائے یا مینڈیٹ کے نافذ کیے جاتے ہیں۔,25b8ea2f028a749cc4a6b1ab7a0041079161a37b,0,35w,1/24/2026 15:09,
Unknown,pt_post003,60,0,اج گلگت بلتستان کی دلالی جس جس بندے نے پاکستان کے لیے کی ہے یا پھر اس سے پہلے کر چکا ہے ایک وقت ایسا ائے گا یہ لوگ اپنی ماں اور اپنی بہن کو بھی پاکستان کے حوالے کریں گے۔۔,bc660025585c2892f70d5a216bca29f551ff5f9f,0,35w,1/24/2026 15:09,
Unknown,pt_post003,61,0,Kya is bill pay assembly Mai session Howa koi bebat Howe agar nahe Howe TU it nay urgent Mai q pass keya gheeya,21b8a599656601f32415640f3a80260336bc0db0,0,35w,1/24/2026 15:09,
Unknown,pt_post003,62,0,ہم اس بل کو مسترد کرتے ہیں آئیے سب گلگت بلتستان کے شہری متحد ہو کر احتجاج کریں اور اپنی سرزمین کی حفاظت کریں اور Kpk اور بلوچستان کا مستقبل دیکھیں ان جیسا نہ بنیں، متحد ہو کر اب گلگت بلتستان کی حفاظت کریں۔,d953cd861096f3d3e47ab46adfa743eac4b4059d,2,35w,1/24/2026 15:09,
Unknown,pt_post003,63,0,We'll not accept it...,c13d79e80b938c1c51e8bba6e6c7cc36b8ce7464,0,35w,1/24/2026 15:09,
Unknown,pt_post003,64,0,Pak Army ko Mubarak ho,67d9a912f39d1dc099096e15b85c026e29c61852,0,35w,1/24/2026 15:09,
Unknown,pt_post003,65,0,امجد ایڈوکیٹ جیسے قابل قانون دان گلگت بلتستان کے ایک ایک فرد کے دل میں بستا ہے اور گلگت بلتستان کا درد رکھتا ہے اور ہم اس کی اس عظیم جدوجہد کو اور گلگت بلتستان کی تاریخی قانون سازی پہ خراج تحسین پیش کرتے ہیں ۔,7562077146b95f50be7b7d306a8352391f13adfd,8,35w,1/24/2026 15:09,
Unknown,pt_post003,65,1,@7562077146b95f50be7b7d306a8352391f13adfd سیاسی بندہ عام۔ عوام کا کوئی خیر خواہ نہیں ہوتے سب وفاقی پارٹیوں کے دلال ہے کرسی کے لیے وفاقی پارٹیوں کا ٹٹے اٹھتے ہیں,9a9f7b8dc80b1273dc6e0e4fee1b8e9c8860b0cc,0,35w,1/24/2026 15:09,7562077146b95f50be7b7d306a8352391f13adfd
Unknown,pt_post003,65,2,lanat ho Tum pr or tumhari soch pr,0cbf85c938152574dc14c50ef716b5f5112cf914,0,35w,1/24/2026 15:09,7562077146b95f50be7b7d306a8352391f13adfd
Unknown,pt_post003,65,3,mtlb kvch b,40eb5948437ee245690a604f1313af8b3a36d475,0,35w,1/24/2026 15:09,7562077146b95f50be7b7d306a8352391f13adfd
Unknown,pt_post003,66,0,Awam ne bi accept Kia hai ye?,f9851dda33ca93a3c6efa72192f585fe2fbf1593,0,35w,1/24/2026 15:09,
Unknown,pt_post003,67,0,Kia hai hahahaha. Sub mily hain sub mily hain gareeb logu ko chutiya banaa rahai hai sub mily hain. Yeh in k darmay hain?,e0b9f84a16998643ef6042092d55cba675f4cd90,0,35w,1/24/2026 15:09,
Unknown,pt_post003,68,0,Especially Punjab,006e4eb0b6eca22bd21815e80ba17ba2fd1900c8,0,35w,1/24/2026 15:09,
Unknown,pt_post003,68,1,what Punjab did with you? Such a racist with so many hate about Punjab and Punjabis,aad2f5bb6277b16def6ed2fca989b562e8aeb47d,0,35w,1/24/2026 15:09,006e4eb0b6eca22bd21815e80ba17ba2fd1900c8
Unknown,pt_post003,68,2,kuch b nae kaha sir mai ne konsi aise bat ki hai Punab k khilaf? Dalal qsm se bureaucrat yahan punjab se akr tabahi macha di hai! I did not say anything about common punjabis! I love punjab and common punjabis or punjabi zuban se mje itni muhabbat the k i have learnt punjabi during my stay in punjab! Taday tou v soni punjabi bolna hon mai! Saday naal gal kro punjabi vch. Tusi saday Veer o main tay bureaucrats di gal pay krna jena nay srf Gilgit da nae balkay punjab da v berda ghark kitta ay,006e4eb0b6eca22bd21815e80ba17ba2fd1900c8,0,34w,1/24/2026 15:09,aad2f5bb6277b16def6ed2fca989b562e8aeb47d
Unknown,pt_post003,69,0,Lack the lanat,aa12db3f490009621282a721a69716a5a9a6eaee,0,35w,1/24/2026 15:09,
Unknown,pt_post003,70,0,GB Assembly chand sahulat kar or dalal logu ki panah gah hai #dalalhukumat,048b8ca682f0eaf513cfc75166adef743e8f93f6,2,35w,1/24/2026 15:09,
Unknown,pt_post003,71,0,Gilgit-Baltistan assembly nahi maweyshi mandi .. now Gilgit-Baltistan is under punjabi establishment colony.,f0b1b602602d14206f8680fff66b8fa7e327cca3,10,35w,1/24/2026 15:09,
Unknown,pt_post003,71,1,Vigo,3cc03350daee9d2cf85b540409ee85c97d6a1d2f,0,35w,1/24/2026 15:09,f0b1b602602d14206f8680fff66b8fa7e327cca3
Unknown,pt_post003,71,2,helicopter,f0b1b602602d14206f8680fff66b8fa7e327cca3,0,35w,1/24/2026 15:09,3cc03350daee9d2cf85b540409ee85c97d6a1d2f
Unknown,pt_post003,71,3,,6f4ec0f1901852353a2d98ec7cda2c562b89e324,0,35w,1/24/2026 15:09,f0b1b602602d14206f8680fff66b8fa7e327cca3
Unknown,pt_post003,72,0,Awam is bill ko reject karta hai,6ea679fd7e2554fbecfbefffc1ab22ef055fc0f4,4,35w,1/24/2026 15:09,
Unknown,pt_post003,72,1,kab kara ga baii bill to pass ho gaya,9d7d31554bc12bd1df9aa573f0144e25eea67b55,0,35w,1/24/2026 15:09,6ea679fd7e2554fbecfbefffc1ab22ef055fc0f4
Unknown,pt_post003,72,2,awam ki okaaat nahi,f3dedd519c3798b780989cbf4ee2ef7d4754ba21,0,35w,1/24/2026 15:09,6ea679fd7e2554fbecfbefffc1ab22ef055fc0f4
Unknown,pt_post003,72,3,تمہارے اوقات یے کمنٹ کرنے کا پالش والا,1003c43b952fe5508e97ecf3cfcd621b651d5bd9,2,35w,1/24/2026 15:09,f3dedd519c3798b780989cbf4ee2ef7d4754ba21
Unknown,pt_post003,72,4,tumaray jaisay chotiye bhud hain gb mein,f3dedd519c3798b780989cbf4ee2ef7d4754ba21,0,35w,1/24/2026 15:09,1003c43b952fe5508e97ecf3cfcd621b651d5bd9
Unknown,pt_post003,72,5,tum aj tak hillay nahi mein 11 saaal se laraha hun court mein. Teri kia okaaat hai,f3dedd519c3798b780989cbf4ee2ef7d4754ba21,0,35w,1/24/2026 15:09,1003c43b952fe5508e97ecf3cfcd621b651d5bd9
Unknown,pt_post003,72,6,tuje challenge daita hun apna pura khandan mil kar ak pani ki nalli bana k dhekaow.,f3dedd519c3798b780989cbf4ee2ef7d4754ba21,0,35w,1/24/2026 15:09,1003c43b952fe5508e97ecf3cfcd621b651d5bd9
Unknown,pt_post003,72,7,ہم اس بل کو مسترد کرتے ہیں آئیے سب گلگت بلتستان کے شہری متحد ہو کر احتجاج کریں اور اپنی سرزمین کی حفاظت کریں اور Kpk اور بلوچستان کا مستقبل دیکھیں ان جیسا نہ بنیں، متحد ہو کر اب گلگت بلتستان کی حفاظت کریں۔,d953cd861096f3d3e47ab46adfa743eac4b4059d,0,35w,1/24/2026 15:09,6ea679fd7e2554fbecfbefffc1ab22ef055fc0f4
Unknown,pt_post003,72,8,bhai qabza nai kar sakta specially hunza pa and ya MNAs change honga tou next wale is qanun ko disqualify karan ga no issue,6ea679fd7e2554fbecfbefffc1ab22ef055fc0f4,0,35w,1/24/2026 15:09,f3dedd519c3798b780989cbf4ee2ef7d4754ba21
Unknown,pt_post003,72,9,کسے کے چمچے ہو کتنے ملتا ہے پالش کرنے کا اور ہاں گلگت کو تمہارے دادی نے آ زاد کیا تھا نا,1003c43b952fe5508e97ecf3cfcd621b651d5bd9,0,35w,1/24/2026 15:09,f3dedd519c3798b780989cbf4ee2ef7d4754ba21
Unknown,pt_post003,72,10,sahi keh rahay hou magar awam ko hamaisha lollypop he milta ha,f3dedd519c3798b780989cbf4ee2ef7d4754ba21,0,35w,1/24/2026 15:09,6ea679fd7e2554fbecfbefffc1ab22ef055fc0f4
Unknown,pt_post003,73,0,Awam k rai k bagair Bill pass hona afsoos ka maqam hai .,efd8303210202215540ec5173def285a50321970,0,35w,1/24/2026 15:09,
Unknown,pt_post003,74,0,Gb people's are sleeping,50dd0a682cebc8b77c56748fd571288f5cb781e8,2,35w,1/24/2026 15:09,
Unknown,pt_post003,75,0,They make All people busy with polo koi hosh ma nahi hai sabko polo ki padi hai,57d4f8518fcdcae0e852e8a1c224f6c5c46fa6c6,2,35w,1/24/2026 15:09,
Unknown,pt_post003,76,0,Awam apny huuqooq k leya niklay tou kuch mila hoskta hai - Dr. Shah Jee,fbe9f54c761fffede41da3a625264d5fc75783ad,6,35w,1/24/2026 15:09,
Unknown,pt_post003,77,0,Lakh Lanet Bejty hen jis jis ny vite kita hy,4a1a2958ef8ec74a68e580cc0451930b0ba2ee91,0,35w,1/24/2026 15:09,
Unknown,pt_post003,78,0,Jab Bemar or Unpard CM hoga to Kuch b ho sackta ha,5c1d8985f3aa09b06935f0f9d6fa225b1b046fb4,0,35w,1/24/2026 15:09,
Unknown,pt_post003,79,0,Awam ko atimad may liya hai ya aisay hi is bill ko pass kiya agr koi b hamaray pahadun ya jangalun pay hath dalnay ke koshish karay ga usay acha khasa resistance milay ga,9dc665bc4a866bafdb4d5a7b45c317a517acfe80,0,35w,1/24/2026 15:09,
Unknown,pt_post003,79,1,guimo paty ses atan bary kako,a9f307e599b028cdce86420be2d1b11b9c27dd5a,0,34w,1/24/2026 15:09,9dc665bc4a866bafdb4d5a7b45c317a517acfe80
Unknown,pt_post003,80,0,This is not a bill but an instrument to deprive the people of GB of their land and mineral resources. Severe repercussions will be faced if the puppet government tries to coerce the masses.,b261a80fe841463e9c507c5621d2a76728df5a6f,0,35w,1/24/2026 15:09,
Unknown,pt_post003,81,0,Assembly aur election tu gernal jeet Katy hain...ab yahan awam ka imtihan ha,d2e39a02077e87d043fa834cd1a1e0fa26ade113,0,35w,1/24/2026 15:09,
Unknown,pt_post003,82,0,ہم اپنے سرزمین کی حفاظت جانِ اور مال کی قربانی دئے کرینگے,5d5be3acc88eb5045f7d39184263636212055baa,0,35w,1/24/2026 15:09,
Unknown,pt_post003,83,0,"اصل وڑنا اسے کہتے ہیں۔ RIP Diamer, RIEP GB چند لوگ اپنے مفادات کے لیے اُس حد تک گرگئے کہ پوری قوم کا سودا کر دیا۔",c723b5efcca604034699a8e1cd31a62fe490653a,0,35w,1/24/2026 15:09,
Unknown,pt_post003,84,0,"Ye knsa qanoon hua, GB ki Zameen govt ki hogi agr lawarish hue to. Pagal ho kya...",3deaff534813317ecfd7a174f5c253b284c32faa,0,35w,1/24/2026 15:09,
Unknown,pt_post003,84,1,bhai hunza jaa Kay Zameen sambal apni warna qabza hoga ya Pakistan Hy ya kch bhi hosakta hy,3e182d0f2ddede2b495fddaaf89fdfed02b7f9d7,0,35w,1/24/2026 15:09,3deaff534813317ecfd7a174f5c253b284c32faa
Unknown,pt_post003,84,2,kia kr skty hai Bhai riyasat se koe kabi jeet Saka hai. Unko to Marne ke bd kia hoga ganta b farq nae parta. Bs unne ye lgta hai Jo hai issi Duniya ma hai.,3deaff534813317ecfd7a174f5c253b284c32faa,0,35w,1/24/2026 15:09,3e182d0f2ddede2b495fddaaf89fdfed02b7f9d7
Unknown,pt_post003,85,0,Jago gilgit..yaaa sub to polo dakha na busy ha,0df5ee4a7ad074b1141299c44bfca4d40ba37fd9,0,35w,1/24/2026 15:09,
Unknown,pt_post003,86,0,What does this bill say exactly?,a83c1bec73c753ad3053be3502b971a1789dc5d5,0,35w,1/24/2026 15:09,
Unknown,pt_post003,86,1,"this bill stats that those lands which are not used by the people of GB will be the property of pakistani government like das, tar, even mountains",9dc665bc4a866bafdb4d5a7b45c317a517acfe80,4,35w,1/24/2026 15:09,a83c1bec73c753ad3053be3502b971a1789dc5d5
Unknown,pt_post003,86,2,how come majority approved this bill? Were they out of their senses??),a83c1bec73c753ad3053be3502b971a1789dc5d5,0,35w,1/24/2026 15:09,9dc665bc4a866bafdb4d5a7b45c317a517acfe80
Unknown,pt_post003,86,3,most of them are federal pimps and puppets,3c0f797053879600bda3bf668dcdbd52e83de0ed,0,35w,1/24/2026 15:09,a83c1bec73c753ad3053be3502b971a1789dc5d5
Unknown,pt_post003,87,0,Few puppets in dummy assemble have passed the bill. People of Gilgit Baltistan reject this order. Fight for freedom!,3c0f797053879600bda3bf668dcdbd52e83de0ed,0,35w,1/24/2026 15:09,
Unknown,pt_post003,88,0,Who were the majority voters???,a83c1bec73c753ad3053be3502b971a1789dc5d5,0,35w,1/24/2026 15:09,
Unknown,pt_post003,88,1,kahan & FCNA,76fded35971956954a3380508d967127a5f018cd,0,35w,1/24/2026 15:09,a83c1bec73c753ad3053be3502b971a1789dc5d5gobar
Unknown,pt_post003,89,0,media1.tenor.co,0fd62d4053fd75dd113e5f0baa8806ef18e21e4c,0,35w,1/24/2026 15:09,
Unknown,pt_post003,90,0,,9964380dd7ca8de6a6a2b81a8940ff4cb56e29bf,0,35w,1/24/2026 15:09,
Unknown,pt_post003,91,0,Pakistan occupied assembly gbians didn't accept your bill so bring it to public then public will see this assembly is Pakistani puppets which you install every 5 years,6cc5dc0967cd5e625b3c50d76ececc18f6d48fad,0,35w,1/24/2026 15:09,
Unknown,pt_post003,92,0,Curse on the so called Gilgit Government # we condemn the shameful attitude by the Boot licker CM and his hooligans. #StandwithNawazkhanNaji,33d6128445eaa71d9e12ba10943a570803c1f08e,0,35w,1/24/2026 15:09,
Unknown,pt_post003,93,0,Stone Mafia,8408cc1f938916e17568942f507c64bd1d7d05ec,0,35w,1/24/2026 15:09,
Unknown,pt_post003,94,0,عوام کو چاہئے کہ جس جس نے اس بل کی حمایت کی ہے ان سب کو ننگا کر کے مارنا چاہئے جس طرح بنگالیوں نے کیا تھا,0a38cff7a1c1c11fbef2f0993208a9bf918ee4a8,0,35w,1/24/2026 15:09,
Unknown,pt_post003,95,0,Absolutely not. and we will fight.,42a9829e9d2ba902931943b8bcad19eca4d8289b,0,35w,1/24/2026 15:09,
Unknown,pt_post003,96,0,Hahahaha gb people sleeping hahahaha. Acha hai na yahan sub chor hain. Kisi pe baroosa nahe karna chaheyeh. Sub chor hai sub. Sub apnay apnay lea kam krty hain. Fuck all. Kala b samp hai safad b samp hai?,e0b9f84a16998643ef6042092d55cba675f4cd90,0,35w,1/24/2026 15:09,
Unknown,pt_post003,97,0,Absolutely not .lanaat,f702fdd05e22b51994bee0614f7ed8632d0fa58c,0,35w,1/24/2026 15:09,
Unknown,pt_post003,97,1,Yem b delete e cuxn,a2926096560aae711f3fde978b1029b45f48b8b4,0,35w,1/24/2026 15:09,f702fdd05e22b51994bee0614f7ed8632d0fa58c
Unknown,pt_post003,97,2,"zaq imran khan gezda, absolutely not,",9c19bc286e75c7241e2e3bdcb3533855c890c2f7,0,35w,1/24/2026 15:09,f702fdd05e22b51994bee0614f7ed8632d0fa58c
Unknown,pt_post003,98,0,Punjabistan Jeet gaya hamesha ki Tarah gb ke chand Dalal tumri naslun pe lanat,8f4a0cca74c30a01df6bbc8dc0a087693cfc8564,0,35w,1/24/2026 15:09,
Unknown,pt_post003,98,1,gulami ki adat hui ha gb walo ko,b925bcceb47ae62e979868e055fa37e25c35897c,0,35w,1/24/2026 15:09,8f4a0cca74c30a01df6bbc8dc0a087693cfc8564
Unknown,pt_post003,98,2,bas yar ab wese be Kuch nahi hosakta ab sab gulam ha,8f4a0cca74c30a01df6bbc8dc0a087693cfc8564,0,35w,1/24/2026 15:09,b925bcceb47ae62e979868e055fa37e25c35897c
Unknown,pt_post003,98,3,abi to kaha shuro hui ha aga dakho kia hota ha,b925bcceb47ae62e979868e055fa37e25c35897c,0,35w,1/24/2026 15:09,8f4a0cca74c30a01df6bbc8dc0a087693cfc8564
Unknown,pt_post003,98,4,hahah,8f4a0cca74c30a01df6bbc8dc0a087693cfc8564,0,35w,1/24/2026 15:09,b925bcceb47ae62e979868e055fa37e25c35897c
Unknown,pt_post003,99,0,عوام کے لئے ڈوب مرنے کا مقام ھے,81c4c42f0c8eb3c3042438a9d66ff4b6274d1908,0,35w,1/24/2026 15:09,
Unknown,pt_post003,100,0,Shame.... GB govt members,52c28c4e3ddde579e8bd91c59eced09e0614d39c,0,35w,1/24/2026 15:09,
Unknown,pt_post003,101,0,F..k assembly,4d96e045030bdb3db3c65dcd58e29599d70c9b5e,0,35w,1/24/2026 15:09,
Unknown,pt_post003,102,0,Gilgit-Baltistan Land Reforms Bill....,8be02fb173f48313a33516e04dc5b6fffe769935,0,35w,1/24/2026 15:09,
Unknown,pt_post003,103,0,Strongly condemn,dcabd85f2cc96ad1608dd9dfcad723c0995db0c9,0,35w,1/24/2026 15:09,
Unknown,pt_post003,104,0,Dummy And Nakara Membran thay not major people,1fa6d301a166780454dc6474f5a34e5465b10dc4,0,35w,1/24/2026 15:09,
Unknown,pt_post003,105,0,Thai maliyojar laa bc dalaal log,6e173871696a0e29057458d2f5a1b7c5fb263966,5,35w,1/24/2026 15:09,
Unknown,pt_post003,105,1,shina beshal muxum echr duna,d24137ce664c37ef8f4c8dc5ddc3363fb8f3bf63,0,35w,1/24/2026 15:09,6e173871696a0e29057458d2f5a1b7c5fb263966
Unknown,pt_post003,105,2,Mu Nasirabad r dayaba bey sir mazaq ape,6e173871696a0e29057458d2f5a1b7c5fb263966,0,35w,1/24/2026 15:09,d24137ce664c37ef8f4c8dc5ddc3363fb8f3bf63
Unknown,pt_post006,1,0,,58aeaf470df587809044f93cc6021ac76dd129ad,0,35w,1/24/2026 15:10,
Unknown,pt_post006,2,0,Public debate was a must in this regard,8099c99cfdb6ef0e933c78df575165521860b698,0,35w,1/24/2026 15:10,
Unknown,pt_post006,3,0,"This land, mountains, River, glacier, all belong to the people of Gilgit baltistan, if anyone dares to intervene it must result in bloodshed.",1444118940c0c863cf6274252675bdcbb47b3bcd,6,35w,1/24/2026 15:10,
Unknown,pt_post006,3,1,no bro ya ab boot walyon ka hai,68e9bdb64662c0b317b4d2df09bd3ce3b27f36d9,0,35w,1/24/2026 15:10,1444118940c0c863cf6274252675bdcbb47b3bcd
Unknown,pt_post008,1,0,Those who support it are literally retarded,111bc5e49a39035bc9b7d6817c29588fcbf4d5df,0,35w,1/24/2026 15:11,
Unknown,pt_post008,2,0,Ic baray koyi comment karna Ghayibana Nimaz e jinaza padhnay jeysa hea.,1f66f2d403e697234912f76f12214498c3adbab5,0,35w,1/24/2026 15:11,
Unknown,pt_post008,3,0,People don't know what is it? We did not see any reform yet,bc377ce0c656313e8289ff8a0eb9ac54d19ac7d8,0,35w,1/24/2026 15:11,
Unknown,pt_post008,4,0,صحافی حضرات بھی امجد حسین ایڈووکیٹ کی طرح عوام کے ساتھ مذاق کر رہے ہیں.. صحافیوں اور امجد حسین ایڈووکیٹ کو چاہئے کہ لینڈ ریفارمز بل ہمارے سامنے پیش کریں پھر سوال کریں. گلگت بلتستان کے نوجوان اس متنازع بل کر پڑھنا چاہیں گے.. یہ سوال پوچھا جانا چاہئے کہ ان جنگی حالات میں اسمبلی میں بحث کیلئے پیش کئے بغیر، عوام کے سامنے پیش کئے بغیر اسے اچانک اس طرح پیش کیوں کیا گیا؟؟ وزیر اعلیٰ نے اسمبلی فلور پر کہا ہے اسٹیبلشمنٹ اور بیوروکریسی کی مدد سے بنایا گیا ہے. یاد رہے انہوں نے اپنے پاکستانیوں کا کبھی اچھا نہیں کیا ہے تو ہمارے لئے کیا اچھا کریں گے. بلکہ یہ تو زمینیں قبضے کرنے میں مشہور ہیں.. اب عوام ہمت کرے اور ان سب کو روکے..,e8e51d45d796338675bfefa658a4ca82df2b3375,0,35w,1/24/2026 15:11,
Unknown,pt_post008,5,0,یہ کیا چوتیاپہ ہے جس اسمبلی اور اندر رہنے والے کی کوئی حیثیت نہیں ہو جوکہ 2018 آڈر پر چل رہی ہو جوکہ وفاق کی ماتحت ہوگی اور سارے اختیارات وفاق کے پاس ہو ان سب دلوں کی کیا اوقات کی کوئی انکی بات مانی جائے,005752628aab670dd1b0506c463b378c7356d2ad,0,35w,1/24/2026 15:11,
Unknown,pt_post008,6,0,اس بل کے بارے میں انفارمیشن کی ضرورت ہی نہیں میرے حساب سے جو اسمبلی خود آرڈر 2018 کے تحت چلتی ہے وہ اسمبلی کیا عوام کے مفاد میں کوئی بل بنا سکتی ہے۔۔۔,56d18c377d23e929d38ad41e6c85e52c825e069e,3,35w,1/24/2026 15:11,
Unknown,pt_post008,7,0,This is pro Punjab bill so strongly condamed,bc4d26ff87f7fdf811379f9d71ab811a49d3b52b,2,35w,1/24/2026 15:11,
Unknown,pt_post008,7,1,محمد انور آپ نے ایک صفحہ پڑھا ہے؟ اور یہاں پنجاب کہاں سے آگیا؟ سستا انٹرنیٹ بھی عزاب بن گیا ہے,ce501749e0346d342c87ca96497bac940400e6eb,2,35w,1/24/2026 15:11,
Unknown,pt_post008,7,2,guch aki ross han,54c7e8d65cd01fcbd74d255ab8489803e82be4e2,0,35w,1/24/2026 15:11,ce501749e0346d342c87ca96497bac940400e6eb
Unknown,pt_post008,7,3,jali cheque lakay Jutal sy wapis gyay thy tab ya aqal o fersat kaha soi hwe the enki,ce501749e0346d342c87ca96497bac940400e6eb,0,35w,1/24/2026 15:11,54c7e8d65cd01fcbd74d255ab8489803e82be4e2
Unknown,pt_post008,8,0,What are its contents?,f34b95b81b322f6b2e925b027d344b1ce71c5ee7,0,35w,1/24/2026 15:11,
Unknown,pt_post008,9,0,اِس بل کو دیکھے بغیر مسترد کرنا چاہئے کیونکہ سہولت کاروں سے کوئی اچھی کی اُمید نہیں,20fc4a0e646c029c76864de99590627f78fa101d,0,35w,1/24/2026 15:11,
Unknown,pt_post008,10,0,Basically we need to know full detail and than some one can decide,50261ba3608d0e9b6fdd4617180c15ebcf901e0c,3,35w,1/24/2026 15:11,
Unknown,pt_post009,1,0,Gbian will not accept less than State Subject Rule application.,adcc7e2a60eae47890b9597765dd2f0121c2e1c9,2,3y,1/24/2026 15:12,
Unknown,pt_post010,1,0,This writeup shows the author is politically aligned towards current ruling regime,102a39f0e3a14c3c282dfe23732f474b63571a49,0,33w,1/24/2026 15:13,
Unknown,pt_post010,2,0,Kon pagal hae aaj kal articles open karay wo b Chatgpt sy likha hua,a384385fa5e450f2b325921bb53a621e5568a9b6,0,33w,1/24/2026 15:13,
Unknown,pt_post010,3,0,Thanks to the writer for explaining the Act threadbare.,b16613abbffeb11d7c37ee43b8f2edb0e0115dc0,2,33w,1/24/2026 15:13,
Unknown,pt_post010,4,0,"If the sole purpose of the bill is to exploit the shortcomings, should we celebrate it? Second, is this bill addressing the grievances of people regarding common lands already allotted to institutions? Emdad Hucein",51852627c823b2c9660dca67ee9e8f16efb19420,0,33w,1/24/2026 15:13,
