page_name,post_id,comment_no,reply_no,comment_text,username_anonymised,n_reactions,post_date,collection_date,replied_to_username
Unknown,prgb_post010,2,0,"Knowledge, struggle, victory",c09a3a625af868b4b7d617a341ead8271ab38d1b,0,41w,1/24/2026 14:44,
Unknown,prgb_post012,1,0,میری عوامی ایکشن کمیٹی سے گذارش ہے کہ مجوزہ بل کو مسترد کرتے ہوے بجاے سہولت کار اسمبلی، سہولت کار مقامی حکومت اور قابض نوآبادیاتی افسر شاہی سے ہری سنگھ کا اسٹیٹ سبجیکٹ رول کی بحالی کا مطالبہ کرنے کے عوامی ایکشن کمیٹی متنازعہ گلگت بلتستان کے عوام اور نوجوانوں سے اپیل کریں کہ وہ متنازعہ گلگت بلتستان میں آیٰین ساز اسمبلی، خودمختار عدلیہ اور با اختیار مقامی حکومتوں کے قیام کے لیے عوامی تحریک کو منظم کرنے میں اپنا بھرپور حصہ ڈالیں۔ تاکہ متنازعہ گلگت بلتستان سے نوآبادیاتی نظام کا خاتمہ کرکے تنازعہ کشمیر کے حل تک اندرونی خومختاری کے ذریعے متنازعہ گلگت بلتستان کی قومی دولت کو عالمی سرمایہ داری اور ملکی حکمران اشرافیہ کے لوٹ سے بچایا جاسکے۔ عوام کو بنیادی حقوق اور سہولیات میسر کی جاسکے۔ اور متنازعہ گلگت بلتستان کو عالمی سامراج کا چین کے خلاف جنگی مورچے میں تبدیل کرنے سے روکا جاسکے۔,5bfd1150948bbec6f319cd7ca87b2f25437ee209,3,1y,1/24/2026 14:45,
Unknown,prgb_post012,2,0,بات تو سچ ہے مگر اس کے پیچھے ایجنسیوں کے اسمبلی انتخابات,652a4abc7d3ae680b7925b244effaf3fb5d3eb3c,0,1y,1/24/2026 14:45,
Unknown,prgb_post012,3,0,SSR only.,5deece92ae806a934c70df7a93dbfed95219d07c,0,1y,1/24/2026 14:45,
Unknown,prgb_post013,1,0,"Just for the political gaining nothing else, if anything contrary to the public interest is found in the new law, then need elaboration, just saying that this law deprived the indigenous communities from their land is an odd.",716af67060d0900b2526812bc4c81f019c016101,0,19w,1/24/2026 14:46,
Unknown,prgb_post013,2,0,Learn Sindh from it,33cfef5806fe8b3155518bb2ec78f29e102261fa,0,19w,1/24/2026 14:46,
Unknown,prgb_post013,3,0,Great,d258243a1a3c129ce757fc834642293fc68373dd,0,19w,1/24/2026 14:46,
Unknown,prgb_post013,4,0,Bilkul,2fb37e555ab22c262702046f5c563648e4973a49,0,19w,1/24/2026 14:46,
Unknown,prgb_post013,5,0,اس بل میں ان شقوں کو تبدیل کرنے کی ضرورت ہے جو عوامی مشترکہ زمینوں کو سرکاری ملکیت قرار دیا گیا ہیں ۔ چراگاہوں اور پہاڑوں کو سرکاری ملکیت سے عوام کی ملکیت قرار دی جائے اور ڈی سی ۔ اے سی اور تحصیلدار صرف ریکارڈ کا اختیار رکھتے ہیں ۔,e63b7d2d06411a7b043a3c41fcef56ea9e2da43f,0,19w,1/24/2026 14:46,
Unknown,prgb_post013,6,0,احسنت,81dc02dcb87d531c50ac73b49b38529e5c4a1b75,0,19w,1/24/2026 14:46,
Unknown,prgb_post013,7,0,زبردست,f78d6f2207a79868424f35b40e91d52043eb275a,0,19w,1/24/2026 14:46,
Unknown,prgb_post014,1,0,"مجھے بھی اس حوالے سے کچھ تحفظات ہیں لیکن اگر مقامی لوگ اسلام آباد اور پاکستان کے باقی شہروں میں گھر خریدنے کو ترجیح دیں اور اشیاء کی قیمتوں میں اضافے اور بجلی کے بلوں میں سالانہ اضافے کےباوجوداپنے خاندانوں کو وہیں بسانےکی کوشش کریں لیکن کوئی اس ظلم و بربریت اور بدانتظامی کےخلاف آواز بلند کرنے والا نہیں۔ جب گلگت بلتستان بالخصوص ہنزہ کی بات آتی ہے تو اچانک کچھ لوگ خیرخواہوں کی طرح ابھرتے ہیں اگر وہ ہنزہ کے ساتھ اتنے ہی مخلص ہیں تو کیوں نہ پاکستان کے شہروں میں اپنی تمام جائیدادیں بیچ دیں اور اپنے بچوں کے ساتھ ہنزہ آ جائیں اور اپنا پیسہ کہیں ہنزہ میں لگائیں۔ پاکستان اور بیرون ملک کے مختلف شہروں میں بیٹھ کر سوشل میڈیا کے صفحات پر لکھنا آسان ہے۔ اگر ان میں ہمت اور صلاحیت نہیں ہےتوخاموش رہیں اور لوگوں کو کام کرنے دیں۔ وہ بڑے شہروں میں رہتے ہوئے اپنے بچوں کو تمام تر سہولیات فراہم کرنا چاہتے ہیں لیکن ان پسماندہ لوگوں کے لیے رکاوٹیں کھڑی کرنا چاہتے ہیں جو بڑے شہروں میں جائیدادیں خریدنے اور اپنے بچوں کی تعلیم کے متحمل نہیں ہیں۔اگر ہم کچھ نہیں کر سکتے تو ہم خاموش رہیں اور لوگوں کو کام کرنے دیں۔ اگر N-Pak کمپنی معاہدے کے مطابق بجلی فراہم نہیں کر سکتی تو عوام کو احتجاج کرنے اور حکومت کو معاہدہ ختم کرنے پر مجبور کرنےکا قانونی حق حاصل ہے, بس انتظار کریں اور دیکھیں!",e25cc6f196bf2d32a055c21ca3e8feda2575f111,8,8w,1/24/2026 14:47,
Unknown,prgb_post014,1,1,Agri with you,a20eb2c4eab944fd77a66c5502106593700c1b4d,0,8w,1/24/2026 14:47,e25cc6f196bf2d32a055c21ca3e8feda2575f111
Unknown,prgb_post014,1,2,101% agree,1cdd4c35c75321b426ba22cd07e54a3f4292cce3,0,8w,1/24/2026 14:47,a20eb2c4eab944fd77a66c5502106593700c1b4d
Unknown,prgb_post014,2,0,What is his own contribution for Hunza in past and solutions for future...,c91b98931dd20cd4ca447bff5612f7ef30b95285,6,8w,1/24/2026 14:47,
Unknown,prgb_post014,2,1,عیاشی خرافات مس انفارمیشن,c5c93ecdecd0962fdf8ec6acb5ac8182a49422ca,0,8w,1/24/2026 14:47,c91b98931dd20cd4ca447bff5612f7ef30b95285
Unknown,prgb_post014,3,0,ھونزہ کی تاریخ دنیاء کو معلوم ھے 1974 ء تک ھونزہ داخلی طور پر ایک آزاد ریاست تھی جسکو کچھ نادان اور نا عاقبت ادیش نام نہاد پزے لکھے حضرات اور اس وقت کے ایسے اکابرین جو میر اف ھونزہ کے ارد گرد خوش آمدیوں کیصورت میں غیر مناسب اور غیر تعمیری مشورے دیتے رہتے تھے جنکی وجہ سے ایسے عناصر محرومیت کے نام پہ سامنے آگئے اور ھونزہ کی 800 سالہ فدیم آزاد ریاست کا خاتمہ ھو گیا ھونزہ کے عوام کی تاریخ ایک روشن اولعزم محنت کش اور بہادروں کی ھے جو اپنا اچھا برا سمجھتے ھیں جنکے آباؤاجداد نے جنگ آزادی گلگت بلتستان میں قائدانہ کردار ادا کیا تھا جسکا ثبوت چنار باغ گلگت کا یادگار بطور ثبوت قائم دائم ھے باقی رہا موصوف نے ایک گسی پٹی تحریر کے زریعے ھونزہ کے بارے میں سطحی ہمدردی کا اظہار کرتے ھوے ایک بے تکا تحریر پیش کیا ھے جسکی کوئی بنیاد نہیں آپ کے اطلاع کیلئے گزارش کروں کہ جس طریقے سے آغاخان فاونڈیشن کا زیلی ادارہ اے کے آر ایس پی ھے جس نے شمالی علاقہ جات کی دیہی ترقی میں انقلابی کردار ادا کیا ھے اسی طرح IPS بھی آغاخان فاؤنڈیشن کا ایک ادارہ ھے جو صنعتی میدان میں بنیادی کردار ادا کریگا جس کے لئے بجلی پیدا کرنا پہلا فدم ھے اسکے بعد پھر شروع ھو جائینگے ٹوریزم انڈسٹری ایگریکلچر انڈسٹری کاٹیج انڈسٹری معدنی انڈسٹری وغیرہ وغیرہ اسکا ثمر اگلے 10 سالوں میں سامنے جب آئیگا تو یہ موسمی مینڈک جو بے موسم ٹرا رہے ھیں تب نظر نہیں آئینگے,dd2970f918fd04be0042cd9cf42b05ea8daa9d8a,6,8w,1/24/2026 14:47,
Unknown,prgb_post014,3,1,.....by the way your post is more Gisi Piti rather phatii.......without any logic and without any evidence ......do you have a copy of the concession agreement ? Have you read all the clauses? You fail to differentiate even between AKRSP and NAPAK and try to use religion as a shield of your spineless argument.....,7a9cb86e36ad7e32f5ef0cabd7063bb9f26dc429,0,8w,1/24/2026 14:47,dd2970f918fd04be0042cd9cf42b05ea8daa9d8a
Unknown,prgb_post014,3,2,شاہ جہانگیر، کاش آپ میرے نوٹ کو گھسی پٹی (افسوس آپ کو یہ لفظ درست طریقے سے لکھنا بھی نہیں آتا ہے) قرار دینے سے پہلے اپنی معلومات کی صحت کا خیال رکھتے۔ کمال تو یہ ہے کہ آپ پروپیگنڈے کا بری طرح سے شکار ہیں۔ مثلا IPS آغاخان فاونڈیشن کا ایک ادارہ ہے۔ اب بتایں آپ کے اس دعوے پر میں کس طرح تبصرہ کروں۔ یقینا آپ کے اس جھوٹ یا کم علمی پر مجھے کوی پریشانی نہیں ہے۔ بس آپ نے ڈھٹای سے جھوٹ بولا۔ مگر آپ کو کل صبح google کرکے دیکھنا چاہیے کہ IPS کے شیرہولڈرز (مالکان) کتنے ہیں اور کون کون ہیں۔ پھر کل ہی فیس بک پر اپنی اس فاش غلط دعوے پر معذرت کریں تو آپ کی عزت افزای ہوگی۔ اسی طرح آپ کی تمام باتوں کا نہ سر ہے نہ پیر۔ نہ معلومات نہ حقایق اور نہ ہی دلیل۔ خوش رہو۔,5bfd1150948bbec6f319cd7ca87b2f25437ee209,2,8w,1/24/2026 14:47,
Unknown,prgb_post014,3,3,بہت اچھا سوال۔ اگر آپ “Industrial Promotion Services (IPS)” کی بات کر رہے ہیں تو یہ ادارہ Aga Khan Fund for Economic Development (AKFED) کا ہے۔ کچھ اہم نکات: IPS، AKFED کی “industrial and infrastructure development arm” ہے۔ اس کا دائرہ کار صرف پاکستان تک محدود نہیں ہے؛ یہ افریقہ اور مرکزی ایشیا میں بھی کام کرتا ہے۔ IPS مختلف شعبوں میں کام کرتی ہے: زرعی صنعت (agro-industry)، توانائی (renewable power)، مواصلات (telecom)، اور ہیلتھ کیئر۔ ایک مثال: IPS نے افریقہ میں ہائیڈرو پاور پلانٹس میں سرمایہ کاری کی ہے۔ املا کی غلطی پہ معزرت باقی IPS کے بارے میں اور معلومات چاھئیے یا اور کچھ ؟,dd2970f918fd04be0042cd9cf42b05ea8daa9d8a,0,8w,1/24/2026 14:47,5bfd1150948bbec6f319cd7ca87b2f25437ee209
Unknown,prgb_post014,3,4,آپ کو کس قسم کی دلیل یا ثبوت چاھئیے کہ NAPAk IPS آغاخان فنڈ برائے اکنامک ڈیویلپمنٹ کا زیلی ادارہ نہیں آپ کہنا کیا جاھتے ھیں,dd2970f918fd04be0042cd9cf42b05ea8daa9d8a,0,8w,1/24/2026 14:47,7a9cb86e36ad7e32f5ef0cabd7063bb9f26dc429
Unknown,prgb_post014,3,5,جناب والا انڈسٹریل پروموشن سروسز کے انچاس فیصد شیئرز دوسرے ملٹی نیشنل کمپنیوں کے پاس ہیں۔ چودہ اشاریہ پانچ فیصد شیئرز جرمن انویسٹمنٹ کارپوریشن کے ہیں اور باقی دوسرے ملٹی نیشنل کمپنیوں کے پاس ہیں جن کی فہرست ان کے ویبسائٹ پر دستیاب نہیں۔ آغا خان فنڈ فار اکنامک ڈیولپمنٹ کے پاس اکیاون فیصد شیئرز ہیں۔ اس لحاظ سے یہ کمپنی کُلی طور پر آغا خان فنڈ فار اکنامک ڈیولپمنٹ کی ملکیت نہیں ہے۔,52cbac2f244cc336fcc37ab904e603904b66514f,0,8w,1/24/2026 14:47,dd2970f918fd04be0042cd9cf42b05ea8daa9d8a
Unknown,prgb_post014,4,0,جب یہ ادمی IPS کے خلاف ھے تو سمجھو یہ بندہ بےدین ھے! ھنزہ کے لوگو! اس ادمی سے بچ کے رھنا! ھوسکتا ھے یہ غیر ملکی کسی ایجنسی کے لئے کام کرتا ھو تاکہ ھنزہ میں زیادہ نفرتیں پیدا ھو! یھی اس کا ایجنڈا لگتا ھے!!,e54be4d85e3d197d5d3599acb43bc89c7ab2922e,4,8w,1/24/2026 14:47,
Unknown,prgb_post014,4,1,بے دین مطلب ؟ آپ کی نظر میں دین کا مطلب کیا ہے آپ کی ایمان کا پیمانہ کیا ہے جو دوسروں پر بے دین کے القابات سے نوازتے ہو شرم آنی چاہیے آپ کے دنیور اور سلطان آباد میں کی جانے والی کرتوت کھول دوں کیا یہ ذاتیات پر مبنی بات نہ کریں تو اچھا ہے کس کے ایمان تولنے کا پیمانہ آپکا دیا ہوا ہے,b8a2dd21752c8ff21b78edd44865a21d7f3d4717,2,8w,1/24/2026 14:47,e54be4d85e3d197d5d3599acb43bc89c7ab2922e
Unknown,prgb_post014,4,2,ادارے کے خلاف بات کرے گا، رکاوٹ پیدا کرے گا، مسائل پیدا کرے گا باوجود 95 پرسنٹ کمنٹی کے بیج رھتے ھوے تو وہ دیندار نہی ھے! یہ بندہ اغا خان کلچرل سروس میں ملازمت کرتا تھا، وھاں سے کک اوٹ کیا تو یہ ھرکتیں کرتا ھے!,e54be4d85e3d197d5d3599acb43bc89c7ab2922e,0,8w,1/24/2026 14:47,
Unknown,prgb_post014,4,3,bilkul zaffar bhi ya banda koyi thk nhi ha lagta ha koyi agent lag Raha ha,1cdd4c35c75321b426ba22cd07e54a3f4292cce3,0,8w,1/24/2026 14:47,e54be4d85e3d197d5d3599acb43bc89c7ab2922e
Unknown,prgb_post014,4,4,Asa logun ko black list Karna Chaya her group sa,1cdd4c35c75321b426ba22cd07e54a3f4292cce3,2,8w,1/24/2026 14:47,
Unknown,prgb_post014,4,5,: 95 پرسنٹ لوگوں کے درمیان بیٹھ کر مستی دیکھا رھا ھے یہ بندہ! ایسا کام ایجنٹ ھی تو کرتے ھیں بھائ۔,e54be4d85e3d197d5d3599acb43bc89c7ab2922e,0,8w,1/24/2026 14:47,1cdd4c35c75321b426ba22cd07e54a3f4292cce3
Unknown,prgb_post014,4,6,: ان کا چھترول کرنے کی ضرورت ھے جو علاقے کے لئے problem پیدا کرتے ھیں تو۔,e54be4d85e3d197d5d3599acb43bc89c7ab2922e,0,8w,1/24/2026 14:47,1cdd4c35c75321b426ba22cd07e54a3f4292cce3
Unknown,prgb_post014,4,7,mey Tum jaisay deebdaar logon pe lanat bechtaa Hoon jho khojoon ki companies ko deen ka juz Samaj ke follow kartay hain. ....tumhari auqat ka iss post sey pata chal raha hay...jab maloomat mukamal na ho tou baknay ki zaroorat nahi...IPS ki Jo harkatay hain aadey sey ziyada log iss ke khilaf hain magar Khojoon ke dalal Issy ibadat samajh ke bhonktay rehtay hain ....Kuch sharam karo...m,7a9cb86e36ad7e32f5ef0cabd7063bb9f26dc429,0,8w,1/24/2026 14:47,e54be4d85e3d197d5d3599acb43bc89c7ab2922e
Unknown,prgb_post014,4,8,woh agent ha ya nahee apbata Tum 100 % agent ho khojoon ke /////,7a9cb86e36ad7e32f5ef0cabd7063bb9f26dc429,0,8w,1/24/2026 14:47,e54be4d85e3d197d5d3599acb43bc89c7ab2922e
Unknown,prgb_post014,4,9,ظفر بیگ گلوی، آپ کے معلومات اور منطق دیکھیں آپ کے نظر میں IPS ایک مقدس ادارہ ہے۔ حالانکہ یہ ایک ملٹی نیشنل کمپنی ہے جو سور کے گوشت سے لے پلاسٹک، ریٰیل اسٹیٹ اور بجلی کے کارخانے اور کاروبار کرتی ہے۔ پھر اس بڑی کمپنی میں جرمن، فرانس، برطانیہ، ناروے اور امریکہ کے کمپنیوں کے 49 فیصدی شیرز ہیں۔ مگر آپ کہتے ہیں جو IPS کے خلاف بات کرے گا وہ یقینا بے دین ہوگا۔ کیا آپ کے akdn جینوا میں کام کرنے والے بڑے افیسرز سارے آپ کے دین کے پیروکار ہیں یا کچھ دوسرے مذاہب یا بے دین افراد بھی ہیں۔ سوشل میڈیا کے قارین کو معلومات تو دے دیں۔,5bfd1150948bbec6f319cd7ca87b2f25437ee209,6,8w,1/24/2026 14:47,
Unknown,prgb_post014,4,10,خوجوں کے زیر قیادت چلنے والے کاروباری اداروں سے سوال کرنا بے دین ہوگئے کمال کے لوگ ہے کہاں کہاں سے ایسے نگینے صفت لوگ نمودار ہوتے ہیں,d5abcf5f130af7930fead6ba6d73dd5ec14fe74b,0,8w,1/24/2026 14:47,e54be4d85e3d197d5d3599acb43bc89c7ab2922e
Unknown,prgb_post014,5,0,Jalnay walay ka munh kala,47a46951227f61a4bd999c42d6c988e4cb499819,10,8w,1/24/2026 14:47,
Unknown,prgb_post014,5,1,juuuu,a20eb2c4eab944fd77a66c5502106593700c1b4d,0,8w,1/24/2026 14:47,47a46951227f61a4bd999c42d6c988e4cb499819
Unknown,prgb_post014,6,0,jo log is MoU Kay mokhalif thay in ka moun kala,fb8b976da7b4540a191bdae4c20244b703e99b1f,6,8w,1/24/2026 14:47,
Unknown,prgb_post014,6,1,juuuu,a20eb2c4eab944fd77a66c5502106593700c1b4d,0,8w,1/24/2026 14:47,fb8b976da7b4540a191bdae4c20244b703e99b1f
Unknown,prgb_post014,6,2,"ye hy sarkari ki zimedari, lekn GB may kaha hy koi sarkar. Saray thekedar bethy hue hy. Government k intizar may Naslay andhery ma marty marty chali gyi, ab nawabadiyati yad aya.",355f0bdf69ad699370b1c2933e690510eed96b7f,0,8w,1/24/2026 14:47,fb8b976da7b4540a191bdae4c20244b703e99b1fagrchi
Unknown,prgb_post014,6,3,"marhaba Chacha , Juu gor , shuwa sena ,oskilatay thu k ka Sen",9e8b44d9451d2d4a8ffd2fff48519a59b5fbe458,0,8w,1/24/2026 14:47,fb8b976da7b4540a191bdae4c20244b703e99b1f
Unknown,prgb_post014,6,4,"hamay government ka hath bitana chahiye nana jii, AKDN INGOs ya NGOs banay isi liye ha.",fb8b976da7b4540a191bdae4c20244b703e99b1f,0,8w,1/24/2026 14:47,355f0bdf69ad699370b1c2933e690510eed96b7f
Unknown,prgb_post014,6,5,umarat barkat kako Salman,1cdd4c35c75321b426ba22cd07e54a3f4292cce3,0,8w,1/24/2026 14:47,fb8b976da7b4540a191bdae4c20244b703e99b1f
Unknown,prgb_post014,6,6,is bandy ko GB CM seat Dana Chaya,1cdd4c35c75321b426ba22cd07e54a3f4292cce3,0,8w,1/24/2026 14:47,fb8b976da7b4540a191bdae4c20244b703e99b1f
Unknown,prgb_post014,7,0,"I have also reservation but directly we have not concerned,but being Hunzai We support hunza.",f78d6f2207a79868424f35b40e91d52043eb275a,0,8w,1/24/2026 14:47,
Unknown,prgb_post014,8,0,Agreed with the comments of Ameer Hayat shb. Some people are crying now who have enjoyed earlier in these organisations,a692f73668f5e563b65ae62539372b2d9883d409,0,8w,1/24/2026 14:47,
Unknown,prgb_post014,9,0,Pehlay apai Ahmadabad ki tanzeem k paisai lota doo...baqi batain baad main,ea5cf5cfb68ef16302a65e12bea342256fa7b065,3,8w,1/24/2026 14:47,
Unknown,prgb_post014,10,0,Hunza ko maashi Tor pr lootnay ka intezaam aj mukammal ho gya.. Mubarak ho...,a94997d87ec9b7d47c4f9b9a826c7a4b302130a9,3,8w,1/24/2026 14:47,
Unknown,prgb_post014,10,1,9 rupee pr unit ... Toba... Starting he 9 rupee Baad ka pata nhi 9 ka 18 b ho skta hay...,a94997d87ec9b7d47c4f9b9a826c7a4b302130a9,0,8w,1/24/2026 14:47,
Unknown,prgb_post014,11,0,Ya Banda pagal hey ya ehmaq estarha Ki bat usko acha lagta hey Jo khud be kuch Karin face book pey bhonktey key alaea kuch Nahi karty,1e63324b448fa0505c7b5cfb1a1843efe58dac41,2,8w,1/24/2026 14:47,
Unknown,prgb_post014,11,1,ہنزہ کے لیے دوچار اس طرح کے پاگل ہونگے تب ہنزہ کی تقدیر بدلے گا ورانہ تازوں کے چکر میں سارا ہنزہ فروخت ہوجائے گا,d5abcf5f130af7930fead6ba6d73dd5ec14fe74b,0,8w,1/24/2026 14:47,1e63324b448fa0505c7b5cfb1a1843efe58dac41
Unknown,prgb_post014,11,2,شکریہ جناب پاگل اور احمق کا لقب سے نوازنے کے لیے۔ آپ یہ بتایے کہ آپ کو میری کس بات سے زیادہ پریشانی لاحق ہوگیی ہے۔ کیا آپ میرے دلایل، حقایق اور شواہد کو جھٹلا سکتے ہیں۔ کیا آپ نے اس معاہدے کو پڑھا ہے۔ اگر معاہدہ نہیں پڑھا ہے۔ معلومات آپ کے پاس نہیں ہیں تو خاموش ہی رہتے۔ یا مجھ سے معاہدے کی کاپی مانگ لیتے۔,5bfd1150948bbec6f319cd7ca87b2f25437ee209,0,8w,1/24/2026 14:47,1e63324b448fa0505c7b5cfb1a1843efe58dac41
Unknown,prgb_post014,11,3,....Bhai iss Majeed ki photos daikh ke tou nahee lagta ke ye mentally stable hay....ignore kar.....,7a9cb86e36ad7e32f5ef0cabd7063bb9f26dc429,0,8w,1/24/2026 14:47,d5abcf5f130af7930fead6ba6d73dd5ec14fe74b
Unknown,prgb_post014,12,0,Hunza Ka SAB sai bada dalal hai ya tehreer wala,ea2717eb9eb4dc4ac29ab1a29bcdbc33a2adb878,3,8w,1/24/2026 14:47,
Unknown,prgb_post014,13,0,Kash ap us idaray may hotay tou aj ya batain nahe hoti. Ab ap nahe hain tou sub galat??? Hota hai Natural hai dard Takleef or bahot kuch!!!,6ddc0838ef6311555a8017df0987e00083c3396a,0,8w,1/24/2026 14:47,
Unknown,prgb_post014,13,1,you are working as a guest services officer in Serena ...now I understand what is keeping you to talk nonsense !,7a9cb86e36ad7e32f5ef0cabd7063bb9f26dc429,0,8w,1/24/2026 14:47,6ddc0838ef6311555a8017df0987e00083c3396a
Unknown,prgb_post014,13,2,I was working with Serena like sahib was working with AKCSP for various years!,6ddc0838ef6311555a8017df0987e00083c3396a,0,8w,1/24/2026 14:47,7a9cb86e36ad7e32f5ef0cabd7063bb9f26dc429
Unknown,prgb_post014,13,3,"but there is stark difference in what you did (earning money for Khojas and shareholders of IPS with distruction of economy vs what he managed to do -Ciqam Project, women empowerment and environmental protection ) ...you worked to earn money....he worked to bring projects ....is that simply understandable to you ???",7a9cb86e36ad7e32f5ef0cabd7063bb9f26dc429,0,8w,1/24/2026 14:47,6ddc0838ef6311555a8017df0987e00083c3396a
Unknown,prgb_post014,13,4,"je je bilkul sahib, mujay us farq ka pata bahot Achay say hai bhaijan. Chalain Empowerment ki agar ap bath kartay hain tou may phir us behas may nahe jana chahta bhaijan. Bahar hal Jo be kahain wo Jo projects ki bath kar rahay hain unka roots be tou same hai bhaijan!!!",6ddc0838ef6311555a8017df0987e00083c3396a,0,8w,1/24/2026 14:47,7a9cb86e36ad7e32f5ef0cabd7063bb9f26dc429
Unknown,prgb_post014,13,5,mean aap keh rahay hain ke AKDN ney kaam ACHA Kya hay tou uska Haq banta hay ke for -profit projects ki thekadari shukroo karain!!!!,7a9cb86e36ad7e32f5ef0cabd7063bb9f26dc429,0,8w,1/24/2026 14:47,6ddc0838ef6311555a8017df0987e00083c3396a
Unknown,prgb_post014,13,6,bhaijan profit ki bath nahe yahn service ki bath hai!!!,6ddc0838ef6311555a8017df0987e00083c3396a,0,8w,1/24/2026 14:47,7a9cb86e36ad7e32f5ef0cabd7063bb9f26dc429
Unknown,prgb_post014,13,7,...ye aap ki sooch hay.....service Kaisa...monopoly ki baat hay....agar ye intay achay hain tou. Concession agreement qun nahee latay awam ke samnay..... government jab AKDN aur Hunzukutz ke ke beech jaghra kaway gaaa phir aap ko yaad aye gaa,7a9cb86e36ad7e32f5ef0cabd7063bb9f26dc429,0,8w,1/24/2026 14:47,6ddc0838ef6311555a8017df0987e00083c3396a
Unknown,prgb_post014,14,0,Hamaray so called think tanks ko q taklef ho rehi !,9e8b44d9451d2d4a8ffd2fff48519a59b5fbe458,2,8w,1/24/2026 14:47,
Unknown,prgb_post014,14,1,جب بل دینا سٹارٹ کرینگے تب رونا نہی,d81be32fce03db24ad4ba4bcef623ab35c175223,0,8w,1/24/2026 14:47,9e8b44d9451d2d4a8ffd2fff48519a59b5fbe458
Unknown,prgb_post014,14,2,"khuda k wali , tumhay NPak bill danay Kay qabil bana raha hai , har shobay may tumhari taraqi hogi, tum ehel o khudmuktar banday banogay. bill danay say masla hai tov chilas may ja k betho charwahon k sath . These so called think tanks are misleading our sada hunzokux awam, afsos hai",9e8b44d9451d2d4a8ffd2fff48519a59b5fbe458,0,8w,1/24/2026 14:47,d81be32fce03db24ad4ba4bcef623ab35c175223
Unknown,prgb_post014,14,3,ap ko mai abi jawab nai dunga ap ko jawab tub dunga Jub npak aye gi aur ap rona dohna strat karo gey,d81be32fce03db24ad4ba4bcef623ab35c175223,0,8w,1/24/2026 14:47,9e8b44d9451d2d4a8ffd2fff48519a59b5fbe458
Unknown,prgb_post014,15,0,HuNza ma IPS any se mukhlefeen ka mu kala hogya,a20eb2c4eab944fd77a66c5502106593700c1b4d,3,8w,1/24/2026 14:47,
Unknown,prgb_post014,16,0,Kia ham qabur umeed lagaye bathen......jaise bi chahiya Roshni chahiya...,34ff6fddd22db7cb98862f28d35904e8a4ed56de,3,8w,1/24/2026 14:47,
Unknown,prgb_post014,16,1,shuwa chga ata kako,70b09626882c1a009820b82511239843200a0338,0,8w,1/24/2026 14:47,34ff6fddd22db7cb98862f28d35904e8a4ed56de
Unknown,prgb_post014,17,0,"Per my knowledge,NPAK has already invested around 30 Million USD to strengthen the energy infrastructure ( Transmission and Distribution System) in Upper lower and central hunza. This upgrade was fairly necessary before moving towards further generation of power. As per my opinion, it is a great initiative since Water & Power department GB miserably failed to accommodate consumers in decades. Nonetheless, consultation with stakeholders should have been done by relevant Govt. authorities before enacting any agreement with NPAK for the sake of confidence building, fairness and transparency.",b13586a6173cb6e3aaf7138f0bdb8ff5d131a40b,0,8w,1/24/2026 14:47,
Unknown,prgb_post014,18,0,Itni lambi kahani likhnay say power production k lye koi advice deytay baig sab..,860c48f7d793792cfa8fed3e0df8af88ee09dfd0,0,8w,1/24/2026 14:47,
Unknown,prgb_post014,19,0,50 saal agy ka sochta ha aur is ki bataonb ko samjdar hi samj sakta ha proud of u,d24c9da75f66bb043b9c54dffb96dc826b1fe734,0,7w,1/24/2026 14:47,5bfd1150948bbec6f319cd7ca87b2f25437ee209
Unknown,prgb_post014,20,0,Shukar hai jaan chord gaye,4dbc2e1f546b7ed303e76cdb5813beabf9c9fc2d,0,8w,1/24/2026 14:47,
